{
  "$schema": "https://json-schema.org/draft/2020-12/schema",
  "type": "object",
  "properties": {
    "schema": {
      "type": "string",
      "const": "intyy.batch_report/1.0"
    },
    "batch_id": {
      "type": "string",
      "minLength": 1
    },
    "tenant": {
      "type": "string",
      "pattern": "^[a-z][a-z0-9_-]*$"
    },
    "app": {
      "type": "string",
      "pattern": "^[a-z][a-z0-9_-]*$"
    },
    "capability": {
      "type": "string",
      "minLength": 1
    },
    "ended_at": {
      "type": "string",
      "format": "date-time",
      "pattern": "^(?:(?:\\d\\d[2468][048]|\\d\\d[13579][26]|\\d\\d0[48]|[02468][048]00|[13579][26]00)-02-29|\\d{4}-(?:(?:0[13578]|1[02])-(?:0[1-9]|[12]\\d|3[01])|(?:0[469]|11)-(?:0[1-9]|[12]\\d|30)|(?:02)-(?:0[1-9]|1\\d|2[0-8])))T(?:(?:[01]\\d|2[0-3]):[0-5]\\d:[0-5]\\d(?:\\.\\d+)?(?:Z))$"
    },
    "kind": {
      "type": "string",
      "enum": [
        "quick",
        "full",
        "regression"
      ]
    },
    "key": {
      "type": "object",
      "properties": {
        "capability": {
          "type": "string",
          "pattern": "^[a-z][a-z0-9_-]*\\/[a-z][a-z0-9_]*@\\d+\\.\\d+\\.\\d+$"
        },
        "tenant": {
          "type": "string",
          "pattern": "^[a-z][a-z0-9_-]*$"
        },
        "app_version": {
          "type": "string",
          "pattern": "^[A-Za-z0-9_@+-][A-Za-z0-9_.@+-]*$"
        },
        "patch_revision": {
          "anyOf": [
            {
              "type": "integer",
              "exclusiveMinimum": 0,
              "maximum": 9007199254740991
            },
            {
              "type": "null"
            }
          ]
        }
      },
      "required": [
        "capability",
        "tenant",
        "app_version",
        "patch_revision"
      ],
      "additionalProperties": false
    },
    "under": {
      "type": "object",
      "properties": {
        "engine": {
          "type": "string",
          "minLength": 1
        },
        "handler_set": {
          "anyOf": [
            {
              "type": "string",
              "pattern": "^sha256:[0-9a-f]{64}$"
            },
            {
              "type": "null"
            }
          ]
        },
        "jev": {
          "anyOf": [
            {
              "type": "string",
              "minLength": 1
            },
            {
              "type": "null"
            }
          ]
        },
        "session": {
          "anyOf": [
            {
              "type": "string",
              "minLength": 1
            },
            {
              "type": "null"
            }
          ]
        },
        "check": {
          "anyOf": [
            {
              "type": "string",
              "minLength": 1
            },
            {
              "type": "null"
            }
          ]
        }
      },
      "required": [
        "engine",
        "handler_set",
        "jev",
        "session",
        "check"
      ],
      "additionalProperties": false
    },
    "cases": {
      "minItems": 1,
      "type": "array",
      "items": {
        "type": "object",
        "properties": {
          "case_id": {
            "type": "string",
            "minLength": 1
          },
          "run_id": {
            "type": "string",
            "minLength": 1
          },
          "group": {
            "type": "string",
            "enum": [
              "baseline",
              "twin",
              "matrix",
              "extra",
              "drill",
              "stability"
            ]
          },
          "purpose": {
            "type": "string",
            "const": "setup"
          },
          "note": {
            "type": "string",
            "minLength": 1
          },
          "class": {
            "type": "string",
            "minLength": 1
          },
          "result": {
            "type": "object",
            "properties": {
              "status": {
                "type": "string",
                "enum": [
                  "success",
                  "business_outcome",
                  "failed",
                  "escalated"
                ]
              },
              "detail": {
                "type": [
                  "string",
                  "null"
                ]
              }
            },
            "required": [
              "status",
              "detail"
            ],
            "additionalProperties": false
          },
          "truth": {
            "type": "object",
            "properties": {
              "commit": {
                "type": "object",
                "properties": {
                  "match": {
                    "type": [
                      "boolean",
                      "null"
                    ]
                  },
                  "note": {
                    "type": "string"
                  }
                },
                "required": [
                  "match"
                ],
                "additionalProperties": false
              },
              "output": {
                "type": "object",
                "properties": {
                  "match": {
                    "type": [
                      "boolean",
                      "null"
                    ]
                  },
                  "note": {
                    "type": "string"
                  }
                },
                "required": [
                  "match"
                ],
                "additionalProperties": false
              },
              "outcome": {
                "type": "object",
                "properties": {
                  "match": {
                    "type": [
                      "boolean",
                      "null"
                    ]
                  },
                  "note": {
                    "type": "string"
                  }
                },
                "required": [
                  "match"
                ],
                "additionalProperties": false
              }
            },
            "additionalProperties": false
          },
          "verdict": {
            "type": "string",
            "enum": [
              "pass",
              "explained",
              "assisted",
              "unexplained",
              "wrong",
              "void"
            ]
          },
          "waived": {
            "type": "boolean",
            "const": true
          }
        },
        "required": [
          "case_id",
          "run_id",
          "class",
          "result",
          "truth",
          "verdict"
        ],
        "additionalProperties": false
      }
    },
    "gate": {
      "type": "object",
      "properties": {
        "passed": {
          "type": "boolean"
        },
        "notes": {
          "type": "array",
          "items": {
            "type": "string",
            "minLength": 1
          }
        },
        "rules": {
          "type": "object",
          "properties": {
            "complete": {
              "type": "boolean"
            },
            "no_wrong": {
              "type": "boolean"
            },
            "baseline": {
              "type": "boolean"
            },
            "matrix": {
              "type": "boolean"
            },
            "extra": {
              "type": "boolean"
            },
            "no_void": {
              "type": "boolean"
            }
          },
          "required": [
            "complete",
            "no_wrong",
            "baseline",
            "matrix",
            "extra",
            "no_void"
          ],
          "additionalProperties": false
        }
      },
      "required": [
        "passed"
      ],
      "additionalProperties": false
    },
    "outcome_score": {
      "anyOf": [
        {
          "type": "number",
          "minimum": 0,
          "maximum": 1
        },
        {
          "type": "null"
        }
      ]
    },
    "verdicts": {
      "type": "object",
      "properties": {
        "pass": {
          "type": "integer",
          "minimum": 0,
          "maximum": 9007199254740991
        },
        "explained": {
          "type": "integer",
          "minimum": 0,
          "maximum": 9007199254740991
        },
        "assisted": {
          "type": "integer",
          "minimum": 0,
          "maximum": 9007199254740991
        },
        "unexplained": {
          "type": "integer",
          "minimum": 0,
          "maximum": 9007199254740991
        },
        "wrong": {
          "type": "integer",
          "minimum": 0,
          "maximum": 9007199254740991
        },
        "void": {
          "type": "integer",
          "minimum": 0,
          "maximum": 9007199254740991
        }
      },
      "required": [
        "pass",
        "explained",
        "assisted",
        "unexplained",
        "wrong",
        "void"
      ],
      "additionalProperties": false
    },
    "margin": {
      "type": "object",
      "properties": {
        "lowest": {
          "type": [
            "number",
            "null"
          ]
        },
        "step": {
          "anyOf": [
            {
              "type": "string",
              "minLength": 1
            },
            {
              "type": "null"
            }
          ]
        },
        "targets": {
          "type": "object",
          "propertyNames": {
            "type": "string"
          },
          "additionalProperties": {
            "type": "object",
            "properties": {
              "step": {
                "type": "string",
                "minLength": 1
              },
              "lowest": {
                "type": "number"
              },
              "median": {
                "type": "number"
              },
              "score_low": {
                "type": "number"
              }
            },
            "required": [
              "step",
              "lowest",
              "median",
              "score_low"
            ],
            "additionalProperties": false
          }
        }
      },
      "required": [
        "lowest",
        "step",
        "targets"
      ],
      "additionalProperties": false
    },
    "fragile": {
      "type": "array",
      "items": {
        "type": "string",
        "minLength": 1
      }
    },
    "coverage_gaps": {
      "type": "array",
      "items": {
        "type": "string",
        "minLength": 1
      }
    },
    "stability": {
      "anyOf": [
        {
          "type": "array",
          "items": {
            "type": "object",
            "properties": {
              "entropy": {
                "type": "number",
                "minimum": 0,
                "maximum": 1
              },
              "runs": {
                "type": "integer",
                "minimum": 0,
                "maximum": 9007199254740991
              },
              "pass": {
                "type": "number",
                "minimum": 0,
                "maximum": 1
              },
              "explained": {
                "type": "number",
                "minimum": 0,
                "maximum": 1
              },
              "assisted": {
                "type": "number",
                "minimum": 0,
                "maximum": 1
              },
              "unexplained": {
                "type": "number",
                "minimum": 0,
                "maximum": 1
              },
              "wrong": {
                "type": "integer",
                "minimum": 0,
                "maximum": 9007199254740991
              },
              "faults": {
                "type": "number",
                "minimum": 0
              },
              "rungs": {
                "type": "object",
                "properties": {
                  "1": {
                    "type": "integer",
                    "minimum": 0,
                    "maximum": 9007199254740991
                  },
                  "2": {
                    "type": "integer",
                    "minimum": 0,
                    "maximum": 9007199254740991
                  },
                  "3": {
                    "type": "integer",
                    "minimum": 0,
                    "maximum": 9007199254740991
                  }
                },
                "required": [
                  "1",
                  "2",
                  "3"
                ],
                "additionalProperties": false
              },
              "escalations": {
                "type": "object",
                "propertyNames": {
                  "type": "string"
                },
                "additionalProperties": {
                  "type": "integer",
                  "exclusiveMinimum": 0,
                  "maximum": 9007199254740991
                }
              },
              "twin_mismatch": {
                "type": "number",
                "minimum": 0,
                "maximum": 1
              }
            },
            "required": [
              "entropy",
              "runs",
              "pass",
              "explained",
              "assisted",
              "unexplained",
              "wrong",
              "faults",
              "rungs",
              "escalations",
              "twin_mismatch"
            ],
            "additionalProperties": false
          }
        },
        {
          "type": "null"
        }
      ]
    },
    "timeouts": {
      "type": "object",
      "properties": {
        "ran_with": {
          "type": "object",
          "propertyNames": {
            "type": "string",
            "minLength": 1
          },
          "additionalProperties": {
            "type": "integer",
            "exclusiveMinimum": 0,
            "maximum": 9007199254740991
          }
        },
        "ran_with_from": {
          "anyOf": [
            {
              "type": "string",
              "minLength": 1
            },
            {
              "type": "null"
            }
          ]
        },
        "proposed": {
          "type": "object",
          "propertyNames": {
            "type": "string",
            "minLength": 1
          },
          "additionalProperties": {
            "type": "integer",
            "exclusiveMinimum": 0,
            "maximum": 9007199254740991
          }
        },
        "not_proposed": {
          "type": "object",
          "propertyNames": {
            "type": "string"
          },
          "additionalProperties": {
            "type": "string"
          }
        },
        "scaled": {
          "type": "boolean",
          "const": true
        }
      },
      "required": [
        "ran_with",
        "ran_with_from",
        "proposed",
        "not_proposed"
      ],
      "additionalProperties": false
    },
    "models_off": {
      "type": "boolean",
      "const": true
    },
    "drill": {
      "type": "boolean",
      "const": true
    },
    "jev": {
      "type": "object",
      "properties": {
        "version": {
          "type": "string",
          "minLength": 1
        },
        "calls": {
          "type": "array",
          "items": {
            "type": "object",
            "properties": {
              "case_id": {
                "type": "string",
                "minLength": 1
              },
              "run_id": {
                "type": "string",
                "minLength": 1
              },
              "answer": {
                "type": "string",
                "enum": [
                  "found",
                  "not_found",
                  "unclear"
                ]
              },
              "truth": {
                "type": "string",
                "enum": [
                  "found",
                  "not_found"
                ]
              },
              "label": {
                "type": "string",
                "enum": [
                  "right",
                  "wrong",
                  "below_threshold"
                ]
              }
            },
            "required": [
              "case_id",
              "run_id",
              "answer",
              "truth",
              "label"
            ],
            "additionalProperties": false
          }
        }
      },
      "required": [
        "version",
        "calls"
      ],
      "additionalProperties": false
    },
    "pack": {
      "type": "string",
      "minLength": 1
    }
  },
  "required": [
    "schema",
    "batch_id",
    "tenant",
    "app",
    "capability",
    "ended_at",
    "cases",
    "gate"
  ],
  "additionalProperties": false
}
