{
  "schema": "intyy.batch_report/1.0",
  "batch_id": "batch_2026-10-02_gf018jxvqw",
  "tenant": "keystone",
  "app": "kvfcu",
  "capability": "kvfcu/open_share_subaccount@1",
  "ended_at": "2026-10-02T18:19:11.716Z",
  "cases": [
    {
      "case_id": "case",
      "run_id": "run_2026-10-02_ncyxw2vp7x",
      "class": "valid",
      "result": {
        "status": "success",
        "detail": null
      },
      "truth": {
        "commit": {
          "match": null,
          "note": "commit truth unavailable: the case names no notes input"
        },
        "output": {
          "match": null,
          "note": "the oracle found no account to compare"
        }
      },
      "verdict": "pass"
    }
  ],
  "gate": {
    "passed": true
  }
}
