{
  "schema": "intyy.batch_report/1.0",
  "batch_id": "batch_2026-10-02_ae8npw6zq7",
  "tenant": "keystone",
  "app": "kvfcu",
  "capability": "kvfcu/open_share_subaccount@1",
  "ended_at": "2026-10-02T04:46:06.973Z",
  "cases": [
    {
      "case_id": "case",
      "run_id": "run_2026-10-02_f2tdhzpxyr",
      "class": "valid",
      "result": {
        "status": "failed",
        "detail": "checkpoint_timeout"
      },
      "truth": {
        "commit": {
          "match": null,
          "note": "commit truth unavailable: the case names no notes input"
        }
      },
      "verdict": "unexplained"
    }
  ],
  "gate": {
    "passed": false
  }
}
