{
  "schema": "intyy.batch_report/1.0",
  "batch_id": "batch_2026-10-02_spcsfm9sgk",
  "tenant": "keystone",
  "app": "kvfcu",
  "capability": "kvfcu/open_share_subaccount@1",
  "ended_at": "2026-10-02T15:48:40.316Z",
  "cases": [
    {
      "case_id": "case",
      "run_id": "run_2026-10-02_xjf75swk3f",
      "class": "valid",
      "result": {
        "status": "escalated",
        "detail": "reconciliation_decision/reconciliation_waived/click_ok"
      },
      "truth": {
        "commit": {
          "match": null,
          "note": "commit truth unavailable: the case names no notes input"
        }
      },
      "verdict": "pass",
      "waived": true
    }
  ],
  "gate": {
    "passed": true
  }
}
