{
  "schema": "intyy.batch_report/1.0",
  "batch_id": "batch_2026-10-01_dvsyk2em11",
  "tenant": "keystone",
  "app": "kvfcu",
  "capability": "kvfcu/open_share_subaccount@1",
  "ended_at": "2026-10-01T23:18:21.060Z",
  "cases": [
    {
      "case_id": "case",
      "run_id": "run_2026-10-01_h3p8yf3qy2",
      "class": "valid",
      "result": {
        "status": "failed",
        "detail": "session_lost"
      },
      "truth": {
        "commit": {
          "match": null,
          "note": "commit truth unavailable: the case names no notes input"
        }
      },
      "verdict": "unexplained"
    }
  ],
  "gate": {
    "passed": false
  }
}
