{
  "schema": "intyy.batch_report/1.0",
  "batch_id": "batch_2026-10-01_dfccxe0bn7",
  "tenant": "keystone",
  "app": "kvfcu",
  "capability": "kvfcu/open_share_subaccount@1",
  "ended_at": "2026-10-01T23:20:24.899Z",
  "cases": [
    {
      "case_id": "case",
      "run_id": "run_2026-10-01_40mh2hdj7m",
      "class": "valid",
      "result": {
        "status": "escalated",
        "detail": "takeover/stuck/click_member"
      },
      "truth": {
        "commit": {
          "match": null,
          "note": "commit truth unavailable: the case names no notes input"
        }
      },
      "verdict": "unexplained"
    }
  ],
  "gate": {
    "passed": false
  }
}
