{
  "schema": "intyy.batch_report/1.0",
  "batch_id": "batch_2026-10-02_y5ywm5cyaj",
  "tenant": "keystone",
  "app": "kvfcu",
  "capability": "kvfcu/open_share_subaccount@1",
  "ended_at": "2026-10-02T02:16:33.805Z",
  "cases": [
    {
      "case_id": "case",
      "run_id": "run_2026-10-02_j0m0yr66w7",
      "class": "valid",
      "result": {
        "status": "escalated",
        "detail": "takeover/stuck/click_search"
      },
      "truth": {
        "commit": {
          "match": null,
          "note": "commit truth unavailable: the case names no notes input"
        }
      },
      "verdict": "pass"
    }
  ],
  "gate": {
    "passed": true
  }
}
