{
  "schema": "intyy.batch_report/1.0",
  "batch_id": "batch_2026-10-02_s0dmedha63",
  "tenant": "keystone",
  "app": "kvfcu",
  "capability": "kvfcu/open_share_subaccount@1",
  "ended_at": "2026-10-02T17:51:26.592Z",
  "cases": [
    {
      "case_id": "baseline",
      "run_id": "run_2026-10-02_jdepc13cmw",
      "class": "valid",
      "result": {
        "status": "escalated",
        "detail": "takeover/unsafe_state/click_search"
      },
      "truth": {},
      "verdict": "unexplained"
    }
  ],
  "gate": {
    "passed": false,
    "notes": [
      "server_error: the baseline sent no request at the commit step, so the fault could not be placed",
      "maintenance: the baseline sent no request at the commit step, so the fault could not be placed",
      "known_popup: the baseline sent no request at the commit step, so the fault could not be placed",
      "unknown_popup: the baseline sent no request at the commit step, so the fault could not be placed",
      "session_expire: the baseline sent no request at the commit step, so the fault could not be placed",
      "reply_lost: the baseline sent no request at the commit step, so the fault could not be placed"
    ]
  },
  "drill": true
}
